[
  {
    "id": "regeringsunderlag",
    "label": "Nuvarande regeringsunderlag",
    "description": "M, KD, L + SD-budget",
    "parties": ["m", "kd", "l", "sd"]
  },
  {
    "id": "rodgront",
    "label": "Rödgrönt",
    "description": "S, V, MP",
    "parties": ["s", "v", "mp"]
  },
  {
    "id": "centerallians",
    "label": "Center-allians",
    "description": "C, L, S",
    "parties": ["c", "l", "s"]
  },
  {
    "id": "borgerligt",
    "label": "Borgerligt block",
    "description": "M, C, KD, L",
    "parties": ["m", "c", "kd", "l"]
  },
  {
    "id": "breddregering",
    "label": "Blocköverskridande (S+C+L+KD)",
    "description": "S, C, L, KD",
    "parties": ["s", "c", "l", "kd"]
  },
  {
    "id": "alla",
    "label": "Alla åtta partier",
    "description": "Hela riksdagen",
    "parties": ["s", "m", "sd", "c", "v", "kd", "l", "mp"]
  }
]
